title,year,genres,keywords,cast,director,overview
Everyone Knows,2018,Crime Drama Mystery,wedding kidnapping family-secrets,Penélope Cruz Javier Bardem Ricardo Darín,Asghar Farhadi,"A Spanish woman returns to her hometown for a wedding, only for tragedy to strike."
Hero,2002,Action Adventure History,assassin king legend,Jet Li Tony Leung Chiu-wai Maggie Cheung,Zhang Yimou,A defense officer terminates three warriors.
House of Flying Daggers,2004,Action Adventure Drama,rebellion romance martial-arts,Takeshi Kaneshiro Andy Lau Ziyi Zhang,Zhang Yimou,A police captain breaks a member of a rebel group out of prison.
"Crouching Tiger, Hidden Dragon",2000,Action Adventure Drama,sword tradition romance,Chow Yun-Fat Michelle Yeoh Ziyi Zhang,Ang Lee,A young warrior steals a sword from a famed swordsman.
Curse of the Golden Flower,2006,Action Drama Romance,empire betrayal dynasty,Chow Yun-Fat Gong Li Jay Chou,Zhang Yimou,An Emperor find his family in a state of chaos.
The Grandmaster,2013,Action Biography Drama,ip-man martial-arts history,Tony Leung Chiu-wai Ziyi Zhang Chang Chen,Wong Kar-wai,The story of martial arts master Ip Man.
Ip Man,2008,Action Biography Drama,martial-arts wing-chun war,Donnie Yen Simon Yam Siu-Wong Fan,Wilson Yip,A wealthy martial artist is forced to work during the Japanese invasion.
Fearless,2006,Action Biography Drama,martial-arts honor tournament,Jet Li Shidô Nakamura Betty Sun,Ronny Yu,A biography of Chinese Martial Arts Master Huo Yuanjia.
Kung Fu Hustle,2004,Action Comedy Fantasy,martial-arts gang slapstick,Stephen Chow Wah Yuen Qiu Yuen,Stephen Chow,A wannabe gangster aspires to join the Axe Gang.
Shaolin Soccer,2001,Action Comedy Sport,kung-fu soccer team,Stephen Chow Wei Zhao Yat-fei Wong,Stephen Chow,Shaolin followers form a soccer team using their martial art skills.
Police Story,1985,Action Comedy Crime,police chase martial-arts,Jackie Chan Maggie Cheung Brigitte Lin,Jackie Chan,A Hong Kong officer must clear his name after being framed.
Hard Boiled,1992,Action Crime Thriller,police undercover shootout,Chow Yun-Fat Tony Leung Chiu-wai Teresa Mo,John Woo,A tough cop teams up with an undercover agent.
The Killer,1989,Action Crime Thriller,hitman police code,Chow Yun-Fat Danny Lee Sally Yeh,John Woo,An assassin accepts one last hit to help a singer.
A Better Tomorrow,1986,Action Crime Drama,brotherhood triad underworld,Lung Ti Yun-Fat Chow Leslie Cheung,John Woo,An ex-gangster tries to reconcile with his policeman brother.
Chungking Express,1994,Comedy Drama Romance,loneliness hong-kong connection,Brigitte Lin Tony Leung Chiu-wai Faye Wong,Wong Kar-wai,Two Hong Kong policemen fall in love.
Fallen Angels,1995,Comedy Drama,hitman hong-kong neon,Leon Lai Michelle Reis Takeshi Kaneshiro,Wong Kar-wai,A story of encounters in the Hong Kong underworld.
Happy Together,1997,Drama Romance,buenos-aires relationship longing,Leslie Cheung Tony Leung Chiu-wai Gregory Dayton,Wong Kar-wai,A couple from Hong Kong seek a better life in Argentina.
2046,2004,Drama Romance Sci-Fi,memory longing future,Tony Leung Chiu-wai Ziyi Zhang Faye Wong,Wong Kar-wai,A writer thinks he is writing about the future.
Everything Everywhere All at Once,2022,Action Adventure Comedy,multiverse family laundry,Michelle Yeoh Stephanie Hsu Ke Huy Quan,Daniel Kwan,A middle-aged immigrant is swept up into an adventure.
Minari,2020,Drama,immigrant family farm,Steven Yeun Yeri Han Alan S. Kim,Lee Isaac Chung,A Korean-American family moves to an Arkansas farm.
Nomadland,2020,Drama,nomad van-life economic-crisis,Frances McDormand David Strathairn Linda May,Chloé Zhao,A woman embarks on a journey as a modern-day nomad.
The Power of the Dog,2021,Drama Romance Western,ranch legacy psychological,Benedict Cumberbatch Kirsten Dunst Jesse Plemons,Jane Campion,A domineering rancher responds with cruelty when his brother marries.
CODA,2021,Comedy Drama Music,deaf family singing,Emilia Jones Marlee Matlin Troy Kotsur,Siân Heder,A hearing person in a deaf family struggles with her aspirations.
The Whale,2022,Drama,reclusion grief redemption,Brendan Fraser Sadie Sink Hong Chau,Darren Aronofsky,A reclusive teacher attempts to reconnect with his daughter.
The Banshees of Inisherin,2022,Comedy Drama,friendship island conflict,Colin Farrell Brendan Gleeson Kerry Condon,Martin McDonagh,Two lifelong friends find themselves at an impasse.
Tar,2022,Drama Music,conductor power decline,Cate Blanchett Noémie Merlant Nina Hoss,Todd Field,"Centers on Lydia Tár, widely considered a great composer-conductor."
Women Talking,2022,Drama,faith community justice,Rooney Mara Claire Foy Jessie Buckley,Sarah Polley,Women of an isolated religious community grapple with a brutal reality.
The Fabelmans,2022,Drama,cinema childhood family,Michelle Williams Paul Dano Seth Rogen,Steven Spielberg,A young man discovers a family secret while exploring films.
Triangle of Sadness,2022,Comedy Drama,wealth island survival,Harris Dickinson Charlbi Dean Woody Harrelson,Ruben Östlund,A celebrity couple are stranded on an island with ultra-rich people.
All Quiet on the Western Front,2022,Action Drama War,world-war-i trenches survival,Felix Kammerer Albrecht Schuch Aaron Hilmer,Edward Berger,A young German soldier's terrifying experiences during World War I.
Living,2022,Drama,legacy illness purpose,Bill Nighy Aimee Lou Wood Alex Sharp,Oliver Hermanus,A humorless civil servant decides to experience life after a diagnosis.
Babylon,2022,Comedy Drama History,hollywood excess silent-to-talkies,Brad Pitt Margot Robbie Diego Calva,Damien Chazelle,Traces the rise and fall of multiple characters in early Hollywood.
The Menu,2022,Comedy Horror Thriller,cooking island mystery,Ralph Fiennes Anya Taylor-Joy Nicholas Hoult,Mark Mylod,Shocking surprises await a couple at an exclusive restaurant.
Bullet Train,2022,Action Comedy Thriller,assassin train japan,Brad Pitt Joey King Aaron Taylor-Johnson,David Leitch,Five assassins on a bullet train find their missions are common.
The Batman,2022,Action Crime Drama,batman riddler gotham,Robert Pattinson Zoë Kravitz Jeffrey Wright,Matt Reeves,Batman investigates hidden corruption in Gotham.
Dune,2021,Action Adventure Sci-Fi,desert prophecy destiny,Timothée Chalamet Rebecca Ferguson Oscar Isaac,Denis Villeneuve,A noble family is entrusted with the protection of a vital element.
Tenet,2020,Action Sci-Fi Thriller,time-inversion espionage survival,John David Washington Robert Pattinson Elizabeth Debicki,Christopher Nolan,A Protagonist journeys through international espionage fighting for survival.
The French Dispatch,2021,Comedy Drama,journalism anthology visual-style,Benicio Del Toro Adrien Brody Tilda Swinton,Wes Anderson,A love letter to journalists set in an outpost of an American newspaper.
Soul,2020,Animation Adventure Comedy,jazz afterlife purpose,Jamie Foxx Tina Fey Graham Norton,Pete Docter,A New York jazz pianist suddenly finds himself in the afterlife.
Promising Young Woman,2020,Crime Drama Mystery,revenge justice trauma,Carey Mulligan Bo Burnham Alison Brie,Emerald Fennell,A young woman seeks vengeance against those who crossed her.
The Father,2020,Drama,dementia aging family,Anthony Hopkins Olivia Colman Mark Gatiss,Florian Zeller,A man begins to doubt his loved ones as he tries to make sense of aging.
Sound of Metal,2019,Drama Music,deafness drummer recovery,Riz Ahmed Olivia Cooke Paul Raci,Darius Marder,A heavy-metal drummer loses his hearing.
A Star Is Born,2018,Drama Music Romance,singer fame addiction,Lady Gaga Bradley Cooper Sam Elliott,Bradley Cooper,A musician helps a young singer find fame.
Black Swan,2010,Drama Thriller,ballet obsession madness,Natalie Portman Mila Kunis Vincent Cassel,Darren Aronofsky,A committed dancer struggles to maintain her sanity.
The Wrestler,2008,Drama Sport,wrestling aging legacy,Mickey Rourke Marisa Tomei Evan Rachel Wood,Darren Aronofsky,A faded professional wrestler must retire.
Lady Bird,2017,Comedy Drama,growing-up mother-daughter high-school,Saoirse Ronan Laurie Metcalf Tracy Letts,Greta Gerwig,An artistically inclined seventeen-year-old girl comes of age.
Moonlight,2016,Drama,growing-up identity miami,Mahershala Ali Naomie Harris Trevante Rhodes,Barry Jenkins,A young African-American man grapples with his identity and sexuality.
Little Women,2019,Drama Romance,sisters family nineteenth-century,Saoirse Ronan Emma Watson Florence Pugh,Greta Gerwig,The beloved story of the March sisters.
Marriage Story,2019,Comedy Drama Romance,divorce family legal,Adam Driver Scarlett Johansson Julia Greer,Noah Baumbach,An incisive look at a marriage breaking up.
JoJo Rabbit,2019,Comedy Drama War,satire childhood imaginary-friend,Roman Griffin Davis Thomasin McKenzie Scarlett Johansson,Taika Waititi,A young boy finds his mother is hiding a Jewish girl.
The Favourite,2018,Biography Comedy Drama,queen-anne palace-intrigue rivalry,Olivia Colman Emma Stone Rachel Weisz,Yorgos Lanthimos,A frail Queen Anne occupies the throne in 18th century England.
The Lobster,2015,Comedy Drama Romance,dystopia relationship animal,Colin Farrell Rachel Weisz Jessica Barden,Yorgos Lanthimos,Single people are obliged to find a partner in forty-five days.
Arrival,2016,Drama Mystery Sci-Fi,linguist alien communication,Amy Adams Jeremy Renner Forest Whitaker,Denis Villeneuve,A linguist works to communicate with alien lifeforms.
Ex Machina,2014,Drama Sci-Fi Thriller,robot turing-test creator,Alicia Vikander Domhnall Gleeson Oscar Isaac,Alex Garland,A young programmer evaluates the human qualities of an A.I.
The Hateful Eight,2015,Crime Drama Mystery,bounty-hunter blizzard cabin,Samuel L. Jackson Kurt Russell Jennifer Jason Leigh,Quentin Tarantino,A bounty hunter and his prisoner find shelter in a blizzard.
Birdman,2014,Comedy Drama,actor broadway ego,Michael Keaton Zach Galifianakis Edward Norton,Alejandro G. Iñárritu,A washed-up superhero actor attempts to revive his career.
Boyhood,2014,Drama,growing-up family time,Ellar Coltrane Patricia Arquette Ethan Hawke,Richard Linklater,"The life of Mason, from early childhood to college."
Gravity,2013,Sci-Fi Thriller,space disaster survival,Sandra Bullock George Clooney Ed Harris,Alfonso Cuarón,Two astronauts work together to survive.
Silver Linings Playbook,2012,Comedy Drama Romance,bipolar-disorder family connection,Bradley Cooper Jennifer Lawrence Robert De Niro,David O. Russell,A former teacher tries to reconcile with his ex-wife.
Argo,2012,Biography Drama Thriller,iran-hostage-crisis cia hollywood,Ben Affleck Bryan Cranston Alan Arkin,Ben Affleck,A CIA agent launches a dangerous operation under Hollywood cover.
Zero Dark Thirty,2012,Drama Thriller,bin-laden cia investigation,Jessica Chastain Joel Edgerton Chris Pratt,Kathryn Bigelow,A chronicle of the decade-long hunt for Osama bin Laden.
The Artist,2011,Comedy Drama Romance,silent-film hollywood talkies,Jean Dujardin Bérénice Bejo John Goodman,Michel Hazanavicius,An egoistical silent movie star meets a young dancer.
The Help,2011,Drama,racism civil-rights southern,Viola Davis Emma Stone Octavia Spencer,Tate Taylor,An author during the civil rights movement writes a book on maids.
Hugo,2011,Adventure Drama Family,paris orphan clockmaker,Asa Butterfield Chloë Grace Moretz Christopher Lee,Martin Scorsese,An orphan in 1931 Paris is wrapped up in a mystery.
True Grit,2010,Drama Western,revenge outlaw frontier,Jeff Bridges Matt Damon Hailee Steinfeld,Joel Coen,A stubborn teenager tracks down her father's murderer.
Winter's Bone,2010,Drama,ozarks poverty family-secrets,Jennifer Lawrence John Hawkes Garret Dillahunt,Debra Granik,An Ozark Mountain girl hunts down her drug-dealing father.
District 9,2009,Action Sci-Fi Thriller,alien apartheid johannesburg,Sharlto Copley Jason Cope Nathalic Boltt,Neill Blomkamp,An extraterrestrial race is forced to live in slum-like conditions.
The Hurt Locker,2008,Drama Thriller War,iraq bomb-disposal army,Jeremy Renner Anthony Mackie Brian Geraghty,Kathryn Bigelow,A Sergeant on an army bomb squad handles his work in maverick ways.
Up in the Air,2009,Comedy Drama Romance,layoffs travel solitude,George Clooney Vera Farmiga Anna Kendrick,Jason Reitman,Ryan Bingham enjoys his life of travel until it's threatened.
The Reader,2008,Drama Romance,holocaust trial guilt,Kate Winslet Ralph Fiennes David Kross,Stephen Daldry,"A law student falls in love with an older woman, only for her to be on trial."
Milk,2008,Biography Drama,harvey-milk lgbt rights,Sean Penn Emile Hirsch Josh Brolin,Gus Van Sant,The story of Harvey Milk and his struggles as an American gay activist.
Slumdog Millionaire,2008,Drama Romance,mumbai game-show poverty,Dev Patel Freida Pinto Saurabh Shukla,Danny Boyle,A Mumbai teenager reflects on his life on a game show.
Juno,2007,Comedy Drama,pregnancy high-school adoption,Elliot Page Michael Cera Jennifer Garner,Jason Reitman,An offbeat young woman makes a selfless decision regarding her child.
The Queen,2006,Biography Drama History,queen-elizabeth princess-diana monarchy,Helen Mirren Michael Sheen James Cromwell,Stephen Frears,Queen Elizabeth II struggles with the death of Princess Diana.
Babel,2006,Drama,tragedy connection global,Brad Pitt Cate Blanchett Gael García Bernal,Alejandro G. Iñárritu,A married couple's tragedy touches off an interlocking story.
Little Miss Sunshine,2006,Comedy Drama,pageant road-trip family,Steve Carell Toni Collette Greg Kinnear,Jonathan Dayton,A family take a cross-country trip for a beauty pageant.
Brokeback Mountain,2005,Drama Romance Western,cowboys forbidden-love nature,Jake Gyllenhaal Heath Ledger Michelle Williams,Ang Lee,The story of a secretive relationship between two cowboys.
Capote,2005,Biography Crime Drama,truman-capote murder-investigation writing,Philip Seymour Hoffman Catherine Keener Clifton Collins Jr.,Bennett Miller,Truman Capote decides to write a book about the murder of a family.
Crash,2004,Crime Drama Thriller,racism connection los-angeles,Don Cheadle Sandra Bullock Thandiwe Newton,Paul Haggis,Los Angeles citizens with separate lives collide in redemptive stories.
Sideways,2004,Comedy Drama Romance,wine road-trip midlife-crisis,Paul Giamatti Thomas Haden Church Virginia Madsen,Alexander Payne,Two men reaching middle age embark on a road trip.
Million Dollar Baby,2004,Drama Sport,boxing mentor-student legacy,Hilary Swank Clint Eastwood Morgan Freeman,Clint Eastwood,A determined woman works to become a professional boxer.
Lost in Translation,2003,Comedy Drama,tokyo loneliness connection,Bill Murray Scarlett Johansson Giovanni Ribisi,Sofia Coppola,A faded movie star and a neglected young woman form a bond in Tokyo.
Mystic River,2003,Crime Drama Mystery,trauma murder investigation,Sean Penn Tim Robbins Kevin Bacon,Clint Eastwood,The lives of childhood friends are shattered when one has a tragedy.
Chicago,2002,Comedy Crime Musical,jazz prison fame,Renée Zellweger Catherine Zeta-Jones Richard Gere,Rob Marshall,Two death-row murderesses develop a fierce rivalry.
The Hours,2002,Drama Romance,virginia-woolf literature connection,Meryl Streep Nicole Kidman Julianne Moore,Stephen Daldry,How the novel 'Mrs. Dalloway' affects three generations of women.
Gosford Park,2001,Comedy Drama Mystery,estate murder-mystery class,Maggie Smith Ryan Phillippe Michael Gambon,Robert Altman,A group of wealthy people gather for a party at a country estate.
Traffic,2000,Crime Drama Thriller,drugs border enforcement,Michael Douglas Catherine Zeta-Jones Benicio Del Toro,Steven Soderbergh,A judge spearheads a war against drugs.
Erin Brockovich,2000,Biography Drama,legal environment justice,Julia Roberts Albert Finney David担,Steven Soderbergh,An unemployed single mother becomes a legal assistant.
The Insider,1999,Biography Drama Thriller,tobacco-industry whistle-blower journalism,Al Pacino Russell Crowe Christopher Plummer,Michael Mann,A research chemist whistle-blows on Big Tobacco.
Shakespeare in Love,1998,Comedy Drama Romance,william-shakespeare theatre romance,Gwyneth Paltrow Joseph Fiennes Geoffrey Rush,John Madden,A young Shakespeare is inspired to write a famous play.
The English Patient,1996,Drama Romance War,desert nurse map,Ralph Fiennes Juliette Binoche Willem Dafoe,Anthony Minghella,A young nurse tends to a badly-burned plane crash victim.
Secrets & Lies,1996,Drama,family secrets identity,Timothy Spall Brenda Blethyn Marianne Jean-Baptiste,Mike Leigh,A black woman traces her white biological mother.
The Postman,1994,Drama,postal-service father-son rural-italy,Massimo Troisi Philippe Noiret Maria Grazia Cucinotta,Michael Radford,A simple postman learns to love poetry while delivering mail.
Sense and Sensibility,1995,Drama Romance,jane-austen sisters nineteenth-century,Emma Thompson Kate Winslet James Fleet,Ang Lee,The two eldest Dashwood sisters deal with their family's poverty.
Quiz Show,1994,Biography Drama,game-show scandal fifties,Ralph Fiennes Rob Morrow David Paymer,Robert Redford,A young lawyer investigates the potentially fixed game show 'Twenty One'.
The Fugitive,1993,Action Crime Thriller,wrongly-accused detective chase,Harrison Ford Tommy Lee Jones Sela Ward,Andrew Davis,Dr. Richard Kimble must find his wife's real killer.
The Piano,1993,Drama Romance,mute music nineteenth-century,Holly Hunter Harvey Keitel Sam Neill,Jane Campion,A mute woman is sent to New Zealand for an arranged marriage.
A Few Good Men,1992,Drama Thriller,courtroom military justice,Tom Cruise Jack Nicholson Demi Moore,Rob Reiner,Military lawyers defend Marines accused of murder.
The Crying Game,1992,Crime Drama Romance,ira kidnapping twist,Stephen Rea Jaye Davidson Forest Whitaker,Neil Jordan,A British soldier kidnapped by the IRA strikes up an unlikely friendship.
Ghost,1990,Drama Fantasy Romance,spirit potter murder,Patrick Swayze Demi Moore Whoopi Goldberg,Jerry Zucker,"After a young man is murdered, his spirit stays behind to warn his lover."
Dances with Wolves,1990,Adventure Drama Western,frontier sioux nature,Kevin Costner Mary McDonnell Graham Greene,Kevin Costner,Lieutenant John Dunbar befriends wolves and Native Americans.
Field of Dreams,1989,Drama Family Fantasy,baseball ghosts cornfield,Kevin Costner Amy Madigan James Earl Jones,Phil Alden Robinson,Iowa farmer Ray Kinsella interprets a voice as instruction to build a baseball diamond.
Rain Man,1988,Drama,autism brothers road-trip,Dustin Hoffman Tom Cruise Valeria Golino,Barry Levinson,Selfish yuppie Charlie Babbitt's brother leaves a fortune to Savant Raymond.
The Last Emperor,1987,Biography Drama History,china pu-yi forbidden-city,John Lone Joan Chen Peter O'Toole,Bernardo Bertolucci,The story of the final Emperor of China.
Out of Africa,1985,Biography Drama Romance,kenya coffee-plantation adventure,Meryl Streep Robert Redford Klaus Maria Brandauer,Sydney Pollack,A Danish baroness has a passionate love affair with a hunter.
The Color Purple,1985,Drama,southern abuse survival,Whoopi Goldberg Danny Glover Oprah Winfrey,Steven Spielberg,A black Southern woman struggles to find her identity after abuse.
The Killing Fields,1984,Biography Drama History,cambodia war journalism,Sam Waterston Haing S. Ngor John Malkovich,Roland Joffé,A journalist is trapped in Cambodia during tyrant Pol Pot's cleansing campaign.
Terms of Endearment,1983,Comedy Drama,mother-daughter family life,Shirley MacLaine Debra Winger Jack Nicholson,James L. Brooks,Follows Aurora and her daughter Emma over several years.
The Big Chill,1983,Comedy Drama,reunion friends sixties,Tom Berenger Glenn Close Jeff Goldblum,Lawrence Kasdan,Former college friends gather for a reunion after a funeral.
Tootsie,1982,Comedy Drama Romance,actor soaps drag,Dustin Hoffman Jessica Lange Teri Garr,Sydney Pollack,A talented but difficult actor disguises himself as a woman to get a job.
On Golden Pond,1981,Drama,aging family pond,Katharine Hepburn Henry Fonda Jane Fonda,Mark Rydell,A curmudgeon with a strained relationship with his daughter.
Ordinary People,1980,Drama,trauma family psychology,Donald Sutherland Mary Tyler Moore Judd Hirsch,Robert Redford,The accidental death of the older son strains family relationships.
Kramer vs. Kramer,1979,Drama,divorce father-son custody,Dustin Hoffman Meryl Streep Jane Alexander,Robert Benton,A workaholic returns home to find his wife is leaving him.
All That Jazz,1979,Drama Musical,theatre choreographer death,Roy Scheider Jessica Lange Leland Palmer,Bob Fosse,A choreographer and film director burns the candle at both ends.
Coming Home,1978,Drama War,vietnam-veteran hospital infidelity,Jane Fonda Jon Voight Bruce Dern,Hal Ashby,A woman falls in love with another man while her husband is in Vietnam.
Annie Hall,1977,Comedy Romance,new-york relationships psychoanalysis,Woody Allen Diane Keaton Tony Roberts,Woody Allen,Neurotic New York comedian Alvy Singer falls in love with ditsy Annie Hall.
Nashville,1975,Comedy Drama Musical,country-music anthology tennessee,Keith Carradine Karen Black Ronee Blakley,Robert Altman,Follows twenty-four characters in the lead up to a convention.
American Graffiti,1973,Comedy Drama,teenagers cruising sixties,Richard Dreyfuss Ron Howard Paul Le Mat,George Lucas,High school graduates spend one final night cruising before college.
Cries and Whispers,1972,Drama,sisters illness death,Harriet Andersson Ingrid Thulin Liv Ullmann,Ingmar Bergman,Sisters of a cancer victim are unable to offer her help.
Cabaret,1972,Drama Musical,berlin nazi-rise nightclub,Liza Minnelli Michael York Helmut Griem,Bob Fosse,A nightclub entertainer in Berlin romances two men while the Nazis rise.
Deliverance,1972,Adventure Drama Thriller,canoeing wilderness survival,Jon Voight Burt Reynolds Ned Beatty,John Boorman,Four friends take a canoeing trip they'll never forget.
The Last Picture Show,1971,Drama,small-town youth texas,Timothy Bottoms Jeff Bridges Cybill Shepherd,Peter Bogdanovich,High schoolers come of age in a bleak West Texas town.
Patton,1970,Biography Drama War,general-patton world-war-ii leadership,George C. Scott Karl Malden Stephen Young,Franklin J. Schaffner,The WWII career of the controversial general George S. Patton.
Five Easy Pieces,1970,Drama,drifter family alienation,Jack Nicholson Karen Black Susan Anspach,Bob Rafelson,A talented pianist turns his back on his family to work as a drifter.
MASH,1970,Comedy Drama War,korean-war surgery satire,Donald Sutherland Elliott Gould Tom Skerritt,Robert Altman,Staff of a field hospital use humor to keep their sanity during the Korean War.
Midnight Cowboy,1969,Drama,new-york friendship hustle,Dustin Hoffman Jon Voight Sylvia Miles,John Schlesinger,A naive hustler travels to NYC to seek his fortune but ends up on the streets.
Z,1969,Crime Drama Thriller,politics investigation greece,Yves Montand Irene Papas Jean-Louis Trintignant,Costa-Gavras,An investigator tries to uncover the truth about a politician's assassination.
Oliver!,1968,Adventure Drama Family,orphan london musical,Mark Lester Ron Moody Shani Wallis,Carol Reed,An orphan runs away from an orphanage and joins pickpockets.
Funny Girl,1968,Biography Comedy Drama,fanny-brice broadway musical,Barbra Streisand Omar Sharif Kay Medford,William Wyler,The life of Fanny Brice from the slums to the heights of her career.
Guess Who's Coming to Dinner,1967,Comedy Drama,racism family marriage,Spencer Tracy Sidney Poitier Katharine Hepburn,Stanley Kramer,A couple introductory meeting with their daughter's African-American fiancé.
Elmer Gantry,1960,Drama,evangelism corruption greed,Burt Lancaster Jean Simmons Arthur Kennedy,Richard Brooks,A fast-talking con man and female evangelist join forces.
The Diary of Anne Frank,1959,Biography Drama Family,anne-frank holocaust hiding,Millie Perkins Shelley Winters Joseph Schildkraut,George Stevens,A young Jewish girl and her family are forced into hiding.
Gigi,1958,Comedy Musical Romance,paris courtesan romance,Leslie Caron Maurice Chevalier Louis Jourdan,Vincente Minnelli,A rich playboy and a youthful courtesan enjoy a platonic friendship.
The Defiant Ones,1958,Crime Drama,racism prison escape,Tony Curtis Sidney Poitier Theodore Bikel,Stanley Kramer,Two escaped convicts must learn to get along to elude police.
Sayonara,1957,Drama Romance War,japan forbidden-love racism,Marlon Brando Patricia Owens Red Buttons,Joshua Logan,An Air Force pilot falls in love with a Japanese dancer.
Around the World in 80 Days,1956,Adventure Comedy Family,journey bet victorian,David Niven Cantinflas Shirley MacLaine,Michael Anderson,A Victorian gentleman bets he can circumnavigate the globe.
The King and I,1956,Biography Drama Musical,siam teacher king,Deborah Kerr Yul Brynner Rita Moreno,Walter Lang,A governess to the King of Siam's children.
Marty,1955,Drama Romance,bronx loneliness love,Ernest Borgnine Betsy Blair Esther Minciotti,Delbert Mann,A butcher and a schoolteacher find love in the Bronx.
Mister Roberts,1955,Comedy Drama War,navy cargo-ship authority,Henry Fonda James Cagney William Powell,John Ford,An officer on a cargo ship is thwarted by his captain.
On the Waterfront,1954,Crime Drama Thriller,docks corruption union,Marlon Brando Karl Malden Lee J. Cobb,Elia Kazan,An ex-prize fighter struggles against his corrupt union bosses.
The Caine Mutiny,1954,Drama War,navy mutiny authority,Humphrey Bogart José Ferrer Van Johnson,Edward Dmytryk,A captain mental instability jeopardizes the ship.
From Here to Eternity,1953,Drama Romance War,pearl-harbor army romance,Burt Lancaster Montgomery Clift Deborah Kerr,Fred Zinnemann,Army life and romance in 1941 Hawaii.
The Greatest Show on Earth,1952,Drama Family Romance,circus performance love,Betty Hutton Cornel Wilde Charlton Heston,Cecil B. DeMille,Dramatic lives of the performers of a major circus.
An American in Paris,1951,Comedy Musical Romance,paris painter musical,Gene Kelly Leslie Caron Oscar Levant,Vincente Minnelli,Three friends struggle to find work in Paris and fall in love.
