title,year,genres,keywords,cast,director,overview
The Incredibles,2004,Animation Action Adventure,superhero family identity,Craig T. Nelson Holly Hunter Samuel L. Jackson,Brad Bird,"A family of undercover superheroes, while trying to live the quiet suburban life, are forced into action."
Ratatouille,2007,Animation Adventure Comedy,rat cooking paris,Brad Garrett Lou Romano Patton Oswalt,Brad Bird,A rat who can cook makes an unusual alliance with a young kitchen worker.
Toy Story 2,1999,Animation Adventure Comedy,toys rescue friendship,Tom Hanks Tim Allen Joan Cusack,John Lasseter,"When Woody is stolen by a toy collector, Buzz and his friends set out to rescue him."
Toy Story 4,2019,Animation Adventure Comedy,toys road-trip purpose,Tom Hanks Tim Allen Annie Potts,Josh Cooley,"When a new toy called 'Forky' joins Woody and the gang, a road trip alongside old and new friends reveals how big the world can be for a toy."
Finding Dory,2016,Animation Adventure Comedy,fish memory family,Ellen DeGeneres Albert Brooks Ed O'Neill,Andrew Stanton,"The friendly but forgetful blue tang fish, Dory, begins a search for her long-lost parents."
Monsters University,2013,Animation Adventure Comedy,monsters college friendship,Billy Crystal John Goodman Steve Buscemi,Dan Scanlon,A look at the relationship between Mike and Sulley during their days at Monsters University.
Despicable Me,2010,Animation Adventure Comedy,villain gadgets orphans,Steve Carell Jason Segel Russell Brand,Pierre Coffin,"When a criminal mastermind uses a trio of orphan girls as pawns for a grand scheme, he finds their love is profoundly changing him for the better."
Minions,2015,Animation Adventure Comedy,minions origin villain,Sandra Bullock Jon Hamm Michael Keaton,Kyle Balda,"Minions Stuart, Kevin and Bob are recruited by Scarlet Overkill, a super-villain who, alongside her inventor husband Herb, hatches a plot to take over the world."
Shrek,2001,Animation Adventure Comedy,ogre fairytale swamp,Mike Myers Eddie Murphy Cameron Diaz,Andrew Adamson,A mean lord exiles fairytale creatures to the swamp of a grumpy ogre.
Shrek 2,2004,Animation Adventure Comedy,ogre fairytale sequel,Mike Myers Eddie Murphy Cameron Diaz,Andrew Adamson,Princess Fiona's parents invite Shrek and Fiona to dinner to celebrate their marriage.
Kung Fu Panda,2008,Animation Action Adventure,panda kung-fu prophecy,Jack Black Ian McShane Angelina Jolie,Mark Osborne,The Dragon Warrior has to clash against the savage Tai Lung as China's fate hangs in the balance.
How to Train Your Dragon 2,2014,Animation Action Adventure,dragon viking sequel,Jay Baruchel Cate Blanchett Gerard Butler,Dean DeBlois,"When Hiccup and Toothless discover an ice cave that is home to hundreds of new wild dragons and the mysterious Dragon Rider, the two friends find themselves at the center of a battle."
The LEGO Movie,2014,Animation Action Adventure,lego prophecy creativity,Chris Pratt Will Ferrell Elizabeth Banks,Phil Lord,"An ordinary LEGO minifigure, mistakenly thought to be the extraordinary MasterBuilder, is recruited to join a quest."
Zootopia,2016,Animation Adventure Comedy,animal city investigation,Ginnifer Goodwin Jason Bateman Idris Elba,Byron Howard,"In a city of anthropomorphic animals, a rookie bunny cop and a cynical con artist fox must work together."
Frozen,2013,Animation Adventure Comedy,ice princess sisters,Kristen Bell Idina Menzel Jonathan Groff,Chris Buck,"When the newly-crowned Queen Elsa accidentally uses her power to turn things into ice, her sister Anna teams up with a mountain man, a playful reindeer, and a snowman."
Moana,2016,Animation Adventure Comedy,ocean island quest,Auli'i Cravalho Dwayne Johnson Rachel House,Ron Clements,"In Ancient Polynesia, when a terrible curse incurred by the Demigod Maui reaches Moana's island, she answers the Ocean's call."
Tangled,2010,Animation Adventure Comedy,rapunzel tower hair,Mandy Moore Zachary Levi Donna Murphy,Nathan Greno,"The magically long-haired Rapunzel has spent her entire life in a tower, but now that a runaway thief has stumbled upon her, she is about to discover the world for the first time."
The Lion King (2019),2019,Animation Adventure Drama,lion savanna remake,Donald Glover Beyoncé Seth Rogen,Jon Favreau,"After the murder of his father, a young lion prince flees his kingdom only to learn the true meaning of responsibility and bravery."
Beauty and the Beast (2017),2017,Family Fantasy Musical,beast curse remake,Emma Watson Dan Stevens Luke Evans,Bill Condon,"A selfish Prince is cursed to become a monster for the rest of his life, unless he learns to fall in love."
Aladdin (2019),2019,Adventure Family Fantasy,genie lamp remake,Will Smith Mena Massoud Naomi Scott,Guy Ritchie,A kind-hearted street urchin and a power-hungry Grand Vizier vie for a magic lamp that has the power to make their deepest wishes come true.
The Jungle Book (2016),2016,Adventure Drama Family,jungle wolf-boy animal,Neel Sethi Bill Murray Ben Kingsley,Jon Favreau,"After a threat from the tiger Shere Khan forces him to flee the jungle, a man-cub named Mowgli embarks on a journey of self discovery."
Harry Potter and the Sorcerer's Stone,2001,Adventure Family Fantasy,magic wizard school,Daniel Radcliffe Rupert Grint Emma Watson,Chris Columbus,"An orphaned boy enrolls in a school of wizardry, where he learns the truth about himself."
Harry Potter and the Chamber of Secrets,2002,Adventure Family Fantasy,magic wizard mystery,Daniel Radcliffe Rupert Grint Emma Watson,Chris Columbus,An ancient prophecy seems to be coming true when a mysterious presence begins stalking the corridors of a school of magic.
Harry Potter and the Prisoner of Azkaban,2004,Adventure Family Fantasy,magic wizard escape,Daniel Radcliffe Rupert Grint Emma Watson,Alfonso Cuarón,"Harry Potter, Ron and Hermione return to Hogwarts School of Witchcraft and Wizardry for their third year of study."
Harry Potter and the Goblet of Fire,2005,Adventure Family Fantasy,magic wizard tournament,Daniel Radcliffe Rupert Grint Emma Watson,Mike Newell,Harry Potter finds himself competing in a hazardous tournament between rival schools of magic.
Harry Potter and the Order of the Phoenix,2007,Adventure Family Fantasy,magic wizard rebellion,Daniel Radcliffe Rupert Grint Emma Watson,David Yates,"With their warning about Lord Voldemort's return scoffed at, Harry and Dumbledore are targeted by the Wizard authorities."
Harry Potter and the Half-Blood Prince,2009,Adventure Family Fantasy,magic wizard destiny,Daniel Radcliffe Rupert Grint Emma Watson,David Yates,"As Harry Potter begins his sixth year at Hogwarts, he discovers an old book marked as 'the property of the Half-Blood Prince'."
Harry Potter and the Deathly Hallows: Part 1,2010,Adventure Family Fantasy,magic wizard finale,Daniel Radcliffe Rupert Grint Emma Watson,David Yates,"As Harry, Ron and Hermione race against time and evil to destroy the Horcruxes, they uncover the existence of the three most powerful objects in the wizarding world."
Harry Potter and the Deathly Hallows: Part 2,2011,Adventure Family Fantasy,magic wizard battle,Daniel Radcliffe Rupert Grint Emma Watson,David Yates,"Harry, Ron, and Hermione search for Voldemort's remaining Horcruxes in their effort to destroy the Dark Lord."
Fantastic Beasts and Where to Find Them,2016,Adventure Family Fantasy,magic creatures wizard,Eddie Redmayne Katherine Waterston Dan Fogler,David Yates,The adventures of writer Newt Scamander in New York's secret community of witches and wizards.
Pirates of the Caribbean: The Curse of the Black Pearl,2003,Action Adventure Fantasy,pirate treasure curse,Johnny Depp Geoffrey Rush Orlando Bloom,Gore Verbinski,Blacksmith Will Turner teams up with eccentric pirate 'Captain Jack Sparrow to save his love.
Pirates of the Caribbean: Dead Man's Chest,2006,Action Adventure Fantasy,pirate kraken sequel,Johnny Depp Orlando Bloom Keira Knightley,Gore Verbinski,Jack Sparrow races to recover the heart of Davy Jones to avoid enslaving his soul.
Pirates of the Caribbean: At World's End,2007,Action Adventure Fantasy,pirate war finale,Johnny Depp Orlando Bloom Keira Knightley,Gore Verbinski,"Captain Barbossa, Will Turner and Elizabeth Swann must sail off the edge of the map, navigate treachery and betrayal."
The Hunger Games,2012,Action Adventure Sci-Fi,dystopia survival game,Jennifer Lawrence Josh Hutcherson Liam Hemsworth,Gary Ross,Katniss Everdeen voluntarily takes her younger sister's place in the Hunger Games.
The Hunger Games: Catching Fire,2013,Action Adventure Sci-Fi,dystopia rebellion game,Jennifer Lawrence Josh Hutcherson Liam Hemsworth,Francis Lawrence,Katniss Everdeen and Peeta Mellark become targets of the Capitol after their victory in the 74th Hunger Games.
The Hunger Games: Mockingjay - Part 1,2014,Action Adventure Sci-Fi,dystopia war rebellion,Jennifer Lawrence Josh Hutcherson Liam Hemsworth,Francis Lawrence,Katniss Everdeen is in District 13 after she shatters the games forever.
The Hunger Games: Mockingjay - Part 2,2015,Action Adventure Sci-Fi,dystopia battle finale,Jennifer Lawrence Josh Hutcherson Liam Hemsworth,Francis Lawrence,"As the war of Panem escalates to the destruction of other districts, Katniss Everdeen must bring together an army against President Snow."
The Twilight Saga: Twilight,2008,Drama Fantasy Romance,vampire romance teen,Kristen Stewart Robert Pattinson Billy Burke,Catherine Hardwicke,"When Bella Swan moves to a small town in the Pacific Northwest, she falls in love with Edward Cullen."
The Twilight Saga: New Moon,2009,Adventure Drama Fantasy,vampire werewolf sequel,Kristen Stewart Robert Pattinson Taylor Lautner,Chris Weitz,Edward leaves Bella after an attack that nearly claimed her life.
The Twilight Saga: Eclipse,2010,Adventure Drama Fantasy,vampire werewolf choice,Kristen Stewart Robert Pattinson Taylor Lautner,David Slade,"As a string of mysterious killings grips Seattle, Bella is forced to choose between her love for vampire Edward and her friendship with werewolf Jacob."
The Twilight Saga: Breaking Dawn - Part 1,2011,Adventure Drama Fantasy,vampire wedding child,Kristen Stewart Robert Pattinson Taylor Lautner,Bill Condon,Edward and Bella must deal with the chain of consequences brought on by a marriage and a honeymoon.
The Twilight Saga: Breaking Dawn - Part 2,2012,Adventure Drama Fantasy,vampire battle finale,Kristen Stewart Robert Pattinson Taylor Lautner,Bill Condon,"After the birth of Renesmee, the Cullens gather other vampire clans in order to protect the child."
The Hobbit: An Unexpected Journey,2012,Adventure Fantasy,hobbit quest mountain,Martin Freeman Ian McKellen Richard Armitage,Peter Jackson,"A reluctant Hobbit, Bilbo Baggins, sets out to the Lonely Mountain."
The Hobbit: The Desolation of Smaug,2013,Adventure Fantasy,hobbit dragon sequel,Martin Freeman Ian McKellen Richard Armitage,Peter Jackson,"The dwarves, along with Bilbo Baggins and Gandalf the Grey, continue their quest to reclaim Erebor."
The Hobbit: The Battle of the Five Armies,2014,Adventure Fantasy,hobbit war finale,Martin Freeman Ian McKellen Richard Armitage,Peter Jackson,Bilbo and Company are forced to engage in a war against an array of combatants.
Fast Five,2011,Action Crime Thriller,car-chase heist brazil,Vin Diesel Paul Walker Dwayne Johnson,Justin Lin,Dominic Toretto and his crew of street racers plan a massive heist in Brazil.
Fast & Furious 6,2013,Action Crime Thriller,car-chase london team,Vin Diesel Paul Walker Dwayne Johnson,Justin Lin,Hobbs has Dominic and Brian reassemble their crew to take down a team of mercenaries.
Furious 7,2015,Action Crime Thriller,car-chase revenge drone,Vin Diesel Paul Walker Dwayne Johnson,James Wan,Deckard Shaw seeks revenge against Dominic Toretto and his family.
The Fate of the Furious,2017,Action Crime Thriller,car-chase betrayal submarine,Vin Diesel Jason Statham Dwayne Johnson,F. Gary Gray,"When a mysterious woman seduces Dominic Toretto into the world of terrorism, the crew face trials."
Mission: Impossible,1996,Action Adventure Thriller,spy embassy mission,Tom Cruise Jon Voight Emmanuelle Béart,Brian De Palma,"An American agent, under false suspicion of disloyalty, must discover and expose the real spy."
Mission: Impossible II,2000,Action Adventure Thriller,spy virus chimera,Tom Cruise Dougray Scott Thandiwe Newton,John Woo,A secret agent is sent to Sydney to find and destroy a genetically modified disease.
Mission: Impossible III,2006,Action Adventure Thriller,spy rabbit-foot vatican,Tom Cruise Ving Rhames Philip Seymour Hoffman,J.J. Abrams,Super-spy Ethan Hunt comes into conflict with a dangerous arms dealer.
Mission: Impossible - Ghost Protocol,2011,Action Adventure Thriller,spy kremlin sandstorm,Tom Cruise Jeremy Renner Simon Pegg,Brad Bird,The IMF is shut down when it's implicated in the bombing of the Kremlin.
Mission: Impossible - Rogue Nation,2015,Action Adventure Thriller,spy syndicate opera,Tom Cruise Rebecca Ferguson Simon Pegg,Christopher McQuarrie,"Ethan and team take on their most impossible mission yet, eradicating the Syndicate."
Mission: Impossible - Fallout,2018,Action Adventure Thriller,spy plutonium helicopter,Tom Cruise Henry Cavill Ving Rhames,Christopher McQuarrie,Ethan Hunt and his IMF team race against time after a mission goes wrong.
Jason Bourne,2016,Action Thriller,spy memory computer-hack,Matt Damon Tommy Lee Jones Alicia Vikander,Paul Greengrass,The CIA's most dangerous former operative is drawn out of hiding.
The Bourne Identity,2002,Action Mystery Thriller,spy amnesia bank,Matt Damon Franka Potente Chris Cooper,Doug Liman,"A man is picked up by a fishing boat, bullet-riddled and suffering from amnesia."
The Bourne Supremacy,2004,Action Mystery Thriller,spy chase assassination,Matt Damon Franka Potente Joan Allen,Paul Greengrass,Jason Bourne is framed for a crime and must elude assassins.
The Bourne Ultimatum,2007,Action Mystery Thriller,spy finale origin,Matt Damon Edgar Ramírez Joan Allen,Paul Greengrass,Jason Bourne dodges a ruthless C.I.A. official while searching for his origins.
The Bourne Legacy,2012,Action Adventure Thriller,spy project drugs,Jeremy Renner Rachel Weisz Edward Norton,Tony Gilroy,"An expansion of the universe from Robert Ludlum's novels, centered on a new hero."
Skyfall,2012,Action Adventure Thriller,bond island computer-hack,Daniel Craig Javier Bardem Naomie Harris,Sam Mendes,James Bond's loyalty to M is tested when her past comes back to haunt her.
Casino Royale,2006,Action Adventure Thriller,bond poker parkour,Daniel Craig Eva Green Mads Mikkelsen,Martin Campbell,"After earning 00 status, Secret Agent James Bond sets out on his first mission."
Quantum of Solace,2008,Action Adventure Thriller,bond revenge desert,Daniel Craig Olga Kurylenko Mathieu Amalric,Marc Forster,James Bond tries to stop a mysterious organization from eliminating a country's resource.
Spectre,2015,Action Adventure Thriller,bond organization shadow,Daniel Craig Christoph Waltz Léa Seydoux,Sam Mendes,A cryptic message from Bond's past sends him on a trail to uncover a sinister organization.
No Time to Die,2021,Action Adventure Thriller,bond virus finale,Daniel Craig Ana de Armas Rami Malek,Cary Joji Fukunaga,James Bond has left active service but is asked to help an old friend.
Jurassic World,2015,Action Adventure Sci-Fi,dinosaurs theme-park disaster,Chris Pratt Bryce Dallas Howard Ty Simpkins,Colin Trevorrow,A new theme park creates a genetically modified hybrid dinosaur.
Jurassic World: Fallen Kingdom,2018,Action Adventure Sci-Fi,dinosaurs volcano rescue,Chris Pratt Bryce Dallas Howard Rafe Spall,J.A. Bayona,Owen and Claire mount a campaign to rescue the remaining dinosaurs from a volcano.
Jurassic World Dominion,2022,Action Adventure Sci-Fi,dinosaurs world-wide legacy,Chris Pratt Bryce Dallas Howard Laura Dern,Colin Trevorrow,Dinosaurs now live and hunt alongside humans all over the world.
Top Gun: Maverick,2022,Action Drama,pilot navy fighter-jet,Tom Cruise Miles Teller Jennifer Connelly,Joseph Kosinski,"After thirty years, Maverick is still pushing the envelope as a top naval aviator."
The Last Samurai,2003,Action Drama History,japan samurai tradition,Tom Cruise Ken Watanabe Billy Connolly,Edward Zwick,An American military advisor embraces the Samurai culture.
Kingdom of Heaven,2005,Action Adventure Drama,crusades jerusalem knight,Orlando Bloom Eva Green Liam Neeson,Ridley Scott,Balian of Ibelin travels to Jerusalem during the Crusades.
300,2006,Action Drama,sparta war thermopylae,Gerard Butler Lena Headey David Wenham,Zack Snyder,King Leonidas of Sparta and 300 men fight the Persians at Thermopylae.
Troy,2004,Drama History,troy war achilles,Brad Pitt Eric Bana Orlando Bloom,Wolfgang Petersen,An adaptation of Homer's epic follows the assault on Troy.
Alexander,2004,Action Biography Drama,con conqueror empire greece,Colin Farrell Anthony Hopkins Rosario Davies,Oliver Stone,Alexander the Great conquers much of the known world.
Master and Commander: The Far Side of the World,2003,Action Adventure Drama,naval war napoleonic,Russell Crowe Paul Bettany Billy Boyd,Peter Weir,A brash British captain pushes his ship and crew in pursuit of a French vessel.
Apollo 13,1995,Adventure Drama History,space mission disaster,Tom Hanks Bill Paxton Kevin Bacon,Ron Howard,NASA must devise a strategy to return Apollo 13 to Earth safely.
First Man,2018,Biography Drama History,nasa moon-landing armstrong,Ryan Gosling Claire Foy Jason Clarke,Damien Chazelle,"A look at the life of the astronaut, Neil Armstrong."
Apollo 11,2019,Documentary History,nasa moon-landing archival,Neil Armstrong Buzz Aldrin Michael Collins,Todd Douglas Miller,A look at the Apollo 11 mission to land on the moon.
Fury,2014,Action Drama War,tank world-war-ii platoon,Brad Pitt Shia LaBeouf Logan Lerman,David Ayer,An army sergeant commands a Sherman tank and her five-man crew.
Letters from Iwo Jima,2006,Drama War,iwo-jima world-war-ii japanese-perspective,Ken Watanabe Kazunari Ninomiya Tsuyoshi Ihara,Clint Eastwood,The battle of Iwo Jima as told from the perspective of the Japanese.
Flags of Our Fathers,2006,Drama History War,iwo-jima world-war-ii american-perspective,Ryan Phillippe Barry Pepper Joseph Cross,Clint Eastwood,The life stories of the men who raised the flag at Iwo Jima.
The Thin Red Line,1998,Drama War,guadalcanal world-war-ii nature,Jim Caviezel Sean Penn Nick Nolte,Terrence Malick,Several US military units are deployed to Guadalcanal in 1942.
The Theory of Everything,2014,Biography Drama Romance,stephen-hawking physics disability,Eddie Redmayne Felicity Jones Tom Prior,James Marsh,The life of the celebrated physicist Stephen Hawking.
The Imitation Game,2014,Biography Drama Thriller,alan-turing enigma computer-science,Benedict Cumberbatch Keira Knightley Matthew Goode,Morten Tyldum,Alan Turing tries to crack the German Enigma code.
The Aviator,2004,Biography Drama,howard-hughes aviation hollywood,Leonardo DiCaprio Cate Blanchett Kate Beckinsale,Martin Scorsese,A biopic depicting the early years of legendary aviator Howard Hughes.
Moneyball,2011,Biography Drama Sport,baseball statistics oakland-as,Brad Pitt Robin Wright Jonah Hill,Bennett Miller,The Oakland A's assembly of a baseball team on a lean budget.
The Big Short,2015,Biography Comedy Drama,financial-crisis wall-street housing-market,Christian Bale Steve Carell Ryan Gosling,Adam McKay,A group of investors bet against the US mortgage market.
The Post,2017,Biography Drama History,journalism pentagon-papers freedom-of-press,Meryl Streep Tom Hanks Sarah Paulson,Steven Spielberg,Newspaper publishers and editors join an unprecedented battle for the truth.
Bridge of Spies,2015,Drama History Thriller,cold-war spy-exchange negotiation,Tom Hanks Mark Rylance Alan Alda,Steven Spielberg,An American lawyer is recruited to help the CIA facilitate an exchange.
Lincoln,2012,Biography Drama History,abraham-lincoln civil-war politics,Daniel Day-Lewis Sally Field David Strathairn,Steven Spielberg,America's president struggles with continuing carnage on the battlefield.
Darkest Hour,2017,Biography Drama History,winston-churchill world-war-ii parliament,Gary Oldman Kristin Scott Thomas Lily James,Joe Wright,"In May 1940, the fate of Western Europe hangs on Winston Churchill."
The King's Speech,2010,Biography Drama History,king-george speech-therapy world-war-ii,Colin Firth Geoffrey Rush Helena Bonham Carter,Tom Hooper,The story of King George VI and the speech therapist who helped him.
Rocketman,2019,Biography Drama Music,elton-john musical addiction,Taron Egerton Jamie Bell Richard Madden,Dexter Fletcher,A musical fantasy about the human story of Elton John's breakthrough years.
Elvis,2022,Biography Drama Music,elvis-presley colonel-tom-parker musical,Austin Butler Tom Hanks Olivia DeJonge,Baz Luhrmann,The life of American music icon Elvis Presley.
Walk the Line,2005,Biography Drama Music,johnny-cash june-carter country-music,Joaquin Phoenix Reese Witherspoon Ginnifer Goodwin,James Mangold,A chronicle of country music legend Johnny Cash's life.
Ray,2004,Biography Drama Music,ray-charles blindness jazz,Jamie Foxx Regina King Kerry Washington,Taylor Hackford,The story of the life and career of the legendary musician Ray Charles.
La Vie en Rose,2007,Biography Drama Music,edith-piaf singer tragic,Marion Cotillard Sylvie Testud Pascal Greggory,Olivier Dahan,Biopic of the iconic French singer Édith Piaf.
Sid and Nancy,1986,Biography Drama Music,sex-pistols punk drug-addiction,Gary Oldman Chloe Webb David Hayman,Alex Cox,Biographical story of Sid Vicious and his girlfriend Nancy Spungen.
Straight Outta Compton,2015,Biography Drama Music,nwa rap hood,O'Shea Jackson Jr. Corey Hawkins Jason Mitchell,F. Gary Gray,The group NWA emerges from Compton and revolutionizes Hip Hop culture.
The Godfather Part III,1990,Crime Drama,mafia finale legacy,Al Pacino Diane Keaton Talia Shire,Francis Ford Coppola,Aging Mafia Don Michael Corleone seeks to avow for his sins.
The Irishman,2019,Biography Crime Drama,mafia hoffa trucker,Robert De Niro Al Pacino Joe Pesci,Martin Scorsese,An old man recalls his time as a hitman for the mob.
The Untouchables,1987,Crime Drama Thriller,al-capone prohibition chicago,Kevin Costner Sean Connery Robert De Niro,Brian De Palma,Federal agent Eliot Ness sets out to stop ruthless gangster Al Capone.
Jackie Brown,1997,Crime Drama Thriller,smuggling setup sting,Pam Grier Samuel L. Jackson Robert Forster,Quentin Tarantino,A flight attendant is pressured into helping a fed set a trap.
Kill Bill: Vol. 2,2004,Action Crime Thriller,revenge assassin finale,Uma Thurman David Carradine Michael Madsen,Quentin Tarantino,The Bride continues her quest of revenge against her former boss.
Once Upon a Time in Hollywood,2019,Comedy Drama,hollywood manson-family nostalgia,Leonardo DiCaprio Brad Pitt Margot Robbie,Quentin Tarantino,A television actor and his stunt double strive for success in 1969 Los Angeles.
Zodiac,2007,Crime Drama Mystery,serial-killer investigation obsession,Jake Gyllenhaal Mark Ruffalo Robert Downey Jr.,David Fincher,A San Francisco cartoonist becomes obsessed with tracking down the Zodiac Killer.
The Girl with the Dragon Tattoo,2011,Crime Drama Mystery,disappearance hacker investigation,Daniel Craig Rooney Mara Christopher Plummer,David Fincher,A journalist is aided in his search by a computer hacker.
Mank,2020,Biography Drama,hollywood screenwriter citizen-kane,Gary Oldman Amanda Seyfried Lily Collins,David Fincher,1930s Hollywood is re-evaluated through the eyes of a screenwriter.
The Host,2006,Horror Sci-Fi Thriller,monster seoul river,Song Kang-ho Byun Hee-bong Park Hae-il,Bong Joon-ho,A monster emerges from Seoul's Han River and attacks people.
Snowpiercer,2013,Action Sci-Fi,train class-struggle ice,Chris Evans Jamie Bell Tilda Swinton,Bong Joon-ho,A failed climate experiment has killed all life except for those on the Snowpiercer.
Okja,2017,Action Adventure Drama,creature corporation activism,Tilda Swinton Paul Dano Seo-hyun Ahn,Bong Joon-ho,A girl risks everything to prevent a company from kidnapping her best friend.
Lady Vengeance,2005,Crime Drama Thriller,revenge redemption tragedy,Lee Young-ae Choi Min-sik Kim Shi-hoo,Park Chan-wook,"After 13-year imprisonment, a woman seeks revenge on the man responsible."
Sympathy for Mr. Vengeance,2002,Action Crime Drama,kidnapping ransom tragedy,Song Kang-ho Shin Ha-kyun Bae Doona,Park Chan-wook,A fired worker kidnaps his boss' daughter for ransom money.
Thirst,2009,Drama Fantasy Horror,vampire priest sin,Song Kang-ho Kim Ok-bin Hee-jin Choi,Park Chan-wook,"Through a failed experiment, a priest is stricken with vampirism."
Broker,2022,Drama,baby-box adoption family,Song Kang-ho Dong-won Gang Bae Doona,Hirokazu Koreeda,The story of people involved with baby boxes for abandoned babies.
Drive My Car,2021,Drama,theatre legacy grief,Hidetoshi Nishijima Tôko Miura Masaki Okada,Ryûsuke Hamaguchi,An aging actor and a young woman develop an unexpected friendship.
Shoplifters,2018,Crime Drama,poverty family shoplifting,Lily Franky Sakura Andô Mayu Matsuoka,Hirokazu Koreeda,A family of crooks take in a child they find in the cold.
The Salesman,2016,Drama,theatre assault revenge,Shahab Hosseini Taraneh Alidoosti Babak Karimi,Asghar Farhadi,A teacher's wife is assaulted in her new home.
A Separation,2011,Drama,marriage divorce family,Peyman Moaadi Leila Hatami Sareh Bayat,Asghar Farhadi,A married couple are faced with a difficult decision regarding their child.
About Elly,2009,Drama Mystery Thriller,disappearance trip secrets,Golshifteh Farahani Taraneh Alidoosti Shahab Hosseini,Asghar Farhadi,A vacation turns into a tragedy when a member of a group goes missing.
The Past,2013,Drama Mystery,divorce family-secrets paris,Bérénice Bejo Tahar Rahim Ali Mosaffa,Asghar Farhadi,An Iranian man deserts his French wife to return home.
